{
  "ok": true,
  "artifact_type": "session-export-audit",
  "generated_at": "2026-07-23T16:51:17.503Z",
  "project_root": "/Users/mn/development/ai-organization-framework-public",
  "cutoff_task_id": "TASK-095",
  "audited_status_dirs": [
    "open",
    "assigned",
    "done"
  ],
  "summary": {
    "scoped_task_count": 21,
    "export_count": 21,
    "accepted_export_count": 21,
    "missing_export_count": 0,
    "failing_check_count": 0
  },
  "tasks": [
    {
      "task_id": "TASK-095",
      "title": "Ship v7.6 Provider-Neutral Session Export",
      "status": "done",
      "status_dir": "done",
      "artifact_ref": ".aof/tasks/done/TASK-095.json"
    },
    {
      "task_id": "TASK-096",
      "title": "Ship v7.7 Adoption-Grade v7 Runtime",
      "status": "done",
      "status_dir": "done",
      "artifact_ref": ".aof/tasks/done/TASK-096.json"
    },
    {
      "task_id": "TASK-097",
      "title": "Ship v7.8 Mission Control Coverage Forecast Projection",
      "status": "done",
      "status_dir": "done",
      "artifact_ref": ".aof/tasks/done/TASK-097.json"
    },
    {
      "task_id": "TASK-098",
      "title": "Ship v7.9 Externalization Readiness Boundary",
      "status": "done",
      "status_dir": "done",
      "artifact_ref": ".aof/tasks/done/TASK-098.json"
    },
    {
      "task_id": "TASK-099",
      "title": "Define v8.0 Externalized Organization Runtime direction",
      "status": "done",
      "status_dir": "done",
      "artifact_ref": ".aof/tasks/done/TASK-099.json"
    },
    {
      "task_id": "TASK-100",
      "title": "Implement v8.0 External Runtime Resource contract and audit",
      "status": "done",
      "status_dir": "done",
      "artifact_ref": ".aof/tasks/done/TASK-100.json"
    },
    {
      "task_id": "TASK-101",
      "title": "Define v8.1 Provider Adapter Governance direction",
      "status": "done",
      "status_dir": "done",
      "artifact_ref": ".aof/tasks/done/TASK-101.json"
    },
    {
      "task_id": "TASK-102",
      "title": "Ship v8.2 Adoption Feedback And Operator Validation Loop",
      "status": "done",
      "status_dir": "done",
      "artifact_ref": ".aof/tasks/done/TASK-102.json"
    },
    {
      "task_id": "TASK-103",
      "title": "Ship v8.3 Mission Control Operator Acceptance Evidence",
      "status": "done",
      "status_dir": "done",
      "artifact_ref": ".aof/tasks/done/TASK-103.json"
    },
    {
      "task_id": "TASK-104",
      "title": "Ship v8.4 Externalized Runtime Operator Safety Proof",
      "status": "done",
      "status_dir": "done",
      "artifact_ref": ".aof/tasks/done/TASK-104.json"
    },
    {
      "task_id": "TASK-105",
      "title": "Ship v8.5 Provider Adapter Execution Pilot Boundary",
      "status": "done",
      "status_dir": "done",
      "artifact_ref": ".aof/tasks/done/TASK-105.json"
    },
    {
      "task_id": "TASK-106",
      "title": "Ship v8.6 Provider Execution Approval Bridge",
      "status": "done",
      "status_dir": "done",
      "artifact_ref": ".aof/tasks/done/TASK-106.json"
    },
    {
      "task_id": "TASK-107",
      "title": "Ship v8.7 Approval Authenticity and Adapter Capability Alignment",
      "status": "done",
      "status_dir": "done",
      "artifact_ref": ".aof/tasks/done/TASK-107.json"
    },
    {
      "task_id": "TASK-108",
      "title": "Ship v8.8 External Runtime Reproduction and Rollback Proof",
      "status": "done",
      "status_dir": "done",
      "artifact_ref": ".aof/tasks/done/TASK-108.json"
    },
    {
      "task_id": "TASK-109",
      "title": "Ship v8.9 External Runtime Outcome Evidence and Learning Loop",
      "status": "done",
      "status_dir": "done",
      "artifact_ref": ".aof/tasks/done/TASK-109.json"
    },
    {
      "task_id": "TASK-110",
      "title": "Ship v9.0 External Runtime Operator Acceptance and Safety Drill",
      "status": "done",
      "status_dir": "done",
      "artifact_ref": ".aof/tasks/done/TASK-110.json"
    },
    {
      "task_id": "TASK-111",
      "title": "Ship v9.1 Product Value Comprehension Gate",
      "status": "done",
      "status_dir": "done",
      "artifact_ref": ".aof/tasks/done/TASK-111.json"
    },
    {
      "task_id": "TASK-112",
      "title": "Ship v9.2 External Runtime Production Boundary Candidate",
      "status": "done",
      "status_dir": "done",
      "artifact_ref": ".aof/tasks/done/TASK-112.json"
    },
    {
      "task_id": "TASK-113",
      "title": "Ship v9.3 Capability-First Release Comprehension",
      "status": "done",
      "status_dir": "done",
      "artifact_ref": ".aof/tasks/done/TASK-113.json"
    },
    {
      "task_id": "TASK-114",
      "title": "Ship v9.4 Provider-backed Controlled Execution Candidate",
      "status": "done",
      "status_dir": "done",
      "artifact_ref": ".aof/tasks/done/TASK-114.json"
    },
    {
      "task_id": "TASK-115",
      "title": "Ship v9.5 External Runtime Incident Drill and Recovery Evidence",
      "status": "done",
      "status_dir": "done",
      "artifact_ref": ".aof/tasks/done/TASK-115.json"
    }
  ],
  "exports": [
    {
      "task_id": "TASK-095",
      "task_ref": ".aof/tasks/done/TASK-095.json",
      "export_ref": ".aof/artifacts/session-exports/TASK-095.json",
      "export_status": "completed",
      "event_count": 7,
      "provider": "local"
    },
    {
      "task_id": "TASK-096",
      "task_ref": ".aof/tasks/done/TASK-096.json",
      "export_ref": ".aof/artifacts/session-exports/TASK-096.json",
      "export_status": "completed",
      "event_count": 7,
      "provider": "local"
    },
    {
      "task_id": "TASK-097",
      "task_ref": ".aof/tasks/done/TASK-097.json",
      "export_ref": ".aof/artifacts/session-exports/TASK-097.json",
      "export_status": "completed",
      "event_count": 7,
      "provider": "local"
    },
    {
      "task_id": "TASK-098",
      "task_ref": ".aof/tasks/done/TASK-098.json",
      "export_ref": ".aof/artifacts/session-exports/TASK-098.json",
      "export_status": "completed",
      "event_count": 7,
      "provider": "local"
    },
    {
      "task_id": "TASK-099",
      "task_ref": ".aof/tasks/done/TASK-099.json",
      "export_ref": ".aof/artifacts/session-exports/TASK-099.json",
      "export_status": "ready",
      "event_count": 7,
      "provider": "local"
    },
    {
      "task_id": "TASK-100",
      "task_ref": ".aof/tasks/done/TASK-100.json",
      "export_ref": ".aof/artifacts/session-exports/TASK-100.json",
      "export_status": "ready",
      "event_count": 7,
      "provider": "local"
    },
    {
      "task_id": "TASK-101",
      "task_ref": ".aof/tasks/done/TASK-101.json",
      "export_ref": ".aof/artifacts/session-exports/TASK-101.json",
      "export_status": "ready",
      "event_count": 7,
      "provider": "local"
    },
    {
      "task_id": "TASK-102",
      "task_ref": ".aof/tasks/done/TASK-102.json",
      "export_ref": ".aof/artifacts/session-exports/TASK-102.json",
      "export_status": "completed",
      "event_count": 7,
      "provider": "local"
    },
    {
      "task_id": "TASK-103",
      "task_ref": ".aof/tasks/done/TASK-103.json",
      "export_ref": ".aof/artifacts/session-exports/TASK-103.json",
      "export_status": "completed",
      "event_count": 7,
      "provider": "local"
    },
    {
      "task_id": "TASK-104",
      "task_ref": ".aof/tasks/done/TASK-104.json",
      "export_ref": ".aof/artifacts/session-exports/TASK-104.json",
      "export_status": "completed",
      "event_count": 7,
      "provider": "local"
    },
    {
      "task_id": "TASK-105",
      "task_ref": ".aof/tasks/done/TASK-105.json",
      "export_ref": ".aof/artifacts/session-exports/TASK-105.json",
      "export_status": "completed",
      "event_count": 7,
      "provider": "local"
    },
    {
      "task_id": "TASK-106",
      "task_ref": ".aof/tasks/done/TASK-106.json",
      "export_ref": ".aof/artifacts/session-exports/TASK-106.json",
      "export_status": "completed",
      "event_count": 7,
      "provider": "local"
    },
    {
      "task_id": "TASK-107",
      "task_ref": ".aof/tasks/done/TASK-107.json",
      "export_ref": ".aof/artifacts/session-exports/TASK-107.json",
      "export_status": "completed",
      "event_count": 7,
      "provider": "local"
    },
    {
      "task_id": "TASK-108",
      "task_ref": ".aof/tasks/done/TASK-108.json",
      "export_ref": ".aof/artifacts/session-exports/TASK-108.json",
      "export_status": "completed",
      "event_count": 7,
      "provider": "local"
    },
    {
      "task_id": "TASK-109",
      "task_ref": ".aof/tasks/done/TASK-109.json",
      "export_ref": ".aof/artifacts/session-exports/TASK-109.json",
      "export_status": "completed",
      "event_count": 7,
      "provider": "local"
    },
    {
      "task_id": "TASK-110",
      "task_ref": ".aof/tasks/done/TASK-110.json",
      "export_ref": ".aof/artifacts/session-exports/TASK-110.json",
      "export_status": "completed",
      "event_count": 7,
      "provider": "local"
    },
    {
      "task_id": "TASK-111",
      "task_ref": ".aof/tasks/done/TASK-111.json",
      "export_ref": ".aof/artifacts/session-exports/TASK-111.json",
      "export_status": "ready",
      "event_count": 7,
      "provider": "local"
    },
    {
      "task_id": "TASK-112",
      "task_ref": ".aof/tasks/done/TASK-112.json",
      "export_ref": ".aof/artifacts/session-exports/TASK-112.json",
      "export_status": "completed",
      "event_count": 7,
      "provider": "local"
    },
    {
      "task_id": "TASK-113",
      "task_ref": ".aof/tasks/done/TASK-113.json",
      "export_ref": ".aof/artifacts/session-exports/TASK-113.json",
      "export_status": "completed",
      "event_count": 7,
      "provider": "local"
    },
    {
      "task_id": "TASK-114",
      "task_ref": ".aof/tasks/done/TASK-114.json",
      "export_ref": ".aof/artifacts/session-exports/TASK-114.json",
      "export_status": "completed",
      "event_count": 7,